{"status":"completed","reports_written":{"json":true,"markdown":true},"moved_files":false,"manifest_changed":false,"notes":"Wrote reports/placement-plan.json and reports/placement-plan.md. Accounted for all 12 inbox items: 11 placed, 1 rejected. Validation: JSON parses; structural and contract assertions passed. Python jsonschema package was not installed, so schema validation was checked via equivalent local assertions."}